{
    "$schema": "https://json-schema.org/draft/2020-12/schema",
    "title": "CourseKit module manifest",
    "type": "object",
    "required": [
        "id"
    ],
    "additionalProperties": false,
    "properties": {
        "id": {
            "type": "string",
            "minLength": 1
        },
        "name": {
            "type": "string"
        },
        "version": {
            "type": "string"
        },
        "namespace": {
            "type": "string"
        },
        "semantic": {
            "type": "array",
            "items": {
                "$ref": "#/$defs/entry"
            }
        },
        "schemas": {
            "type": "array",
            "items": {
                "type": "string"
            }
        },
        "pages": {
            "type": "array",
            "items": {
                "$ref": "#/$defs/entry"
            }
        },
        "components": {
            "type": "array",
            "items": {
                "$ref": "#/$defs/entry"
            }
        },
        "styles": {
            "type": "array",
            "items": {
                "type": "string"
            }
        },
        "scripts": {
            "type": "array",
            "items": {
                "type": "string"
            }
        },
        "resources": {
            "type": "object",
            "additionalProperties": false,
            "properties": {
                "styles": {
                    "type": "array",
                    "items": {
                        "type": "string"
                    }
                },
                "scripts": {
                    "type": "array",
                    "items": {
                        "type": "string"
                    }
                },
                "fonts": {
                    "type": "array",
                    "items": {
                        "type": "object",
                        "required": [
                            "family",
                            "source"
                        ],
                        "additionalProperties": true
                    }
                }
            }
        },
        "pageExtensions": {
            "type": "array",
            "items": {
                "type": "object",
                "required": [
                    "id",
                    "page",
                    "transform"
                ],
                "properties": {
                    "page": {
                        "type": "string"
                    },
                    "parameters": {
                        "type": "object"
                    },
                    "transform": {
                        "type": "string"
                    },
                    "id": {
                        "type": "string",
                        "minLength": 1
                    }
                },
                "additionalProperties": false
            }
        },
        "dependsOn": {
            "type": "array",
            "items": {
                "type": "string"
            }
        }
    },
    "$defs": {
        "entry": {
            "oneOf": [
                {
                    "type": "string",
                    "minLength": 1
                },
                {
                    "type": "object",
                    "required": [
                        "manifest"
                    ],
                    "properties": {
                        "id": {
                            "type": "string"
                        },
                        "manifest": {
                            "type": "string"
                        },
                        "operation": {
                            "enum": [
                                "add",
                                "extend",
                                "override"
                            ]
                        }
                    },
                    "additionalProperties": false
                }
            ]
        }
    }
}
