{
    "id": "learning-module",
    "name": "Learning Extension Module",
    "version": "1.0.0",
    "namespace": "urn:coursekit:semantic:learning",
    "semantic": [
        "$(courseRoot)/modules/learning/semantic/learning-semantic.json"
    ],
    "pageExtensions": [
        {
            "page": "course-page",
            "transform": "$(courseRoot)/modules/learning/pages/learning-page.xslt",
            "id": "learning-page"
        }
    ],
    "dependsOn": []
}
